{
  "schemaVersion": 1,
  "recordMode": "fixture",
  "capabilityId": "fixture-go-ios-cold-cellular-install",
  "operation": "install",
  "support": "unverified",
  "context": {
    "host": {
      "hostId": "a2da35a7-11d4-46e5-a6c9-44ed2c6c7b11",
      "model": null,
      "architecture": "unknown",
      "macOSVersion": null,
      "macOSBuild": null,
      "xcodeVersion": null,
      "xcodeBuild": null
    },
    "device": {
      "deviceId": "device-fixture-phone-01",
      "model": null,
      "iOSVersion": null,
      "iOSBuild": null
    },
    "tailscale": {
      "hostVersion": null,
      "deviceVersion": null
    },
    "backend": {
      "id": "go-ios",
      "version": null,
      "revision": null
    },
    "engineVersion": null,
    "network": {
      "scenario": "cold_cellular",
      "hostUnderlay": "wifi",
      "phoneUnderlay": "cellular",
      "tailnetPath": "unknown",
      "developerSession": "none",
      "internetState": "unknown"
    },
    "signingMode": "development",
    "bootstrapMethod": "existing"
  },
  "qualifiedAt": null,
  "evidenceIds": [],
  "limitations": [
    "Illustrative contract record only. Neither target OS versions nor a cold cellular developer connection have been qualified."
  ],
  "reasonCodes": [
    "CAPABILITY_UNVERIFIED"
  ]
}
